B1: Single Pay Spine for Academic and HE Support Staff, February 2007
M2: Super. @ 22% for NASPS | N2: Super. @ 14% for USS | O2: Nat Ins (ERS) April 07 | P2: Total Empl'rs Costs | Q2: Gross February 2007
A3: £ | B3: Spine Point | C3: £ | D3: £ | E3: £ | F3: £ | G3: £ | H3: £ | I3: £ | J3: £ | K3: £ | L3: £ | M3: £ | N3: £ | O3: £ | P3: £ | Q3: £
C4: Grade 1 | D4: Grade 2 | E4: Grade 3 | F4: Grade 4 | G4: Grade 5 | H4: Grade 6 | I4: Grade 7 | J4: Grade 8 | K4: Grade 9 | L4: Grade 10
A5: 51095 | B5: 52 | K5: 51095 | L5: 51095 | N5: =ROUND(L5*0.14,0) -> 7153 | O5: =ROUND(IF($L5>34840,($L5-34840)*0.128+((34840-5225)*0.091)-25.94,($L5-5225)*0.091)-25.94,0) -> 4724 | P5: =SUM(N5+O5) -> 11877 | Q5: =SUM(L5:O5) -> 62972
A6: 49607 | B6: 51 | K6: 49607 | L6: 49607 | N6: =ROUND(L6*0.14,0) -> 6945 | O6: =ROUND(IF($L6>34840,($L6-34840)*0.128+((34840-5225)*0.091)-25.94,($L6-5225)*0.091)-25.94,0) -> 4533 | P6: =SUM(N6+O6) -> 11478 | Q6: =SUM(L6:O6) -> 61085
A7: 48162 | B7: 50 | K7: 48162 | L7: 48162 | N7: =ROUND(L7*0.14,0) -> 6743 | O7: =ROUND(IF($L7>34840,($L7-34840)*0.128+((34840-5225)*0.091)-25.94,($L7-5225)*0.091)-25.94,0) -> 4348 | P7: =SUM(N7+O7) -> 11091 | Q7: =SUM(L7:O7) -> 59253
A8: 46758 | B8: 49 | K8: 46758 | N8: =ROUND(K8*0.14,0) -> 6546 | O8: =ROUND(IF($K8>34840,($K8-34840)*0.128+((34840-5225)*0.091)-25.94,($K8-5225)*0.091)-25.94,0) -> 4169 | P8: =SUM(N8+O8) -> 10715 | Q8: =SUM(K8:O8) -> 57473
A9: 45397 | B9: 48 | K9: 45397 | N9: =ROUND(K9*0.14,0) -> 6356 | O9: =ROUND(IF($K9>34840,($K9-34840)*0.128+((34840-5225)*0.091)-25.94,($K9-5225)*0.091)-25.94,0) -> 3994 | P9: =SUM(N9+O9) -> 10350 | Q9: =SUM(K9:O9) -> 55747
A10: 44074 | B10: 47 | J10: 44074 | K10: 44074 | N10: =ROUND(K10*0.14,0) -> 6170 | O10: =ROUND(IF($K10>34840,($K10-34840)*0.128+((34840-5225)*0.091)-25.94,($K10-5225)*0.091)-25.94,0) -> 3825 | P10: =SUM(N10+O10) -> 9995 | Q10: =SUM(K10:O10) -> 54069
A11: 42791 | B11: 46 | J11: 42791 | K11: 42791 | N11: =ROUND(K11*0.14,0) -> 5991 | O11: =ROUND(IF($K11>34840,($K11-34840)*0.128+((34840-5225)*0.091)-25.94,($K11-5225)*0.091)-25.94,0) -> 3661 | P11: =SUM(N11+O11) -> 9652 | Q11: =SUM(K11:O11) -> 52443
A12: 41544 | B12: 45 | J12: 41544 | K12: 41544 | N12: =ROUND(K12*0.14,0) -> 5816 | O12: =ROUND(IF($K12>34840,($K12-34840)*0.128+((34840-5225)*0.091)-25.94,($K12-5225)*0.091)-25.94,0) -> 3501 | P12: =SUM(N12+O12) -> 9317 | Q12: =SUM(K12:O12) -> 50861
A13: 40335 | B13: 44 | J13: 40335 | N13: =ROUND(J13*0.14,0) -> 5647 | O13: =ROUND(IF($J13>34840,($J13-34840)*0.128+((34840-5225)*0.091)-25.94,($J13-5225)*0.091)-25.94,0) -> 3346 | P13: =SUM(N13+O13) -> 8993 | Q13: =SUM(J13:O13) -> 49328
A14: 39160 | B14: 43 | J14: 39160 | N14: =ROUND(J14*0.14,0) -> 5482 | O14: =ROUND(IF($J14>34840,($J14-34840)*0.128+((34840-5225)*0.091)-25.94,($J14-5225)*0.091)-25.94,0) -> 3196 | P14: =SUM(N14+O14) -> 8678 | Q14: =SUM(J14:O14) -> 47838
A15: 37642 | B15: 42 | J15: 38019 | N15: =ROUND(J15*0.14,0) -> 5323 | O15: =ROUND(IF($J15>34840,($J15-34840)*0.128+((34840-5225)*0.091)-25.94,($J15-5225)*0.091)-25.94,0) -> 3050 | P15: =SUM(N15+O15) -> 8373 | Q15: =SUM(J15:O15) -> 46392
A16: 36912 | B16: 41 | J16: 36912 | N16: =ROUND(J16*0.14,0) -> 5168 | O16: =ROUND(IF($J16>34840,($J16-34840)*0.128+((34840-5225)*0.091)-25.94,($J16-5225)*0.091)-25.94,0) -> 2908 | P16: =SUM(N16+O16) -> 8076 | Q16: =SUM(J16:O16) -> 44988
A17: 35836 | B17: 40 | J17: 35836 | N17: =ROUND(J17*0.14,0) -> 5017 | O17: =ROUND(IF($J17>34840,($J17-34840)*0.128+((34840-5225)*0.091)-25.94,($J17-5225)*0.091)-25.94,0) -> 2771 | P17: =SUM(N17+O17) -> 7788 | Q17: =SUM(J17:O17) -> 43624
A18: 34793 | B18: 39 | I18: 34793 | J18: 34793 | N18: =ROUND(J18*0.14,0) -> 4871 | O18: =ROUND(IF($J18>34840,($J18-34840)*0.128+((34840-5225)*0.091)-25.94,($J18-5225)*0.091)-25.94,0) -> 2665 | P18: =SUM(N18+O18) -> 7536 | Q18: =SUM(J18:O18) -> 42329
A19: 33799 | B19: 38 | I19: 33799 | N19: =ROUND(I19*0.14,0) -> 4732 | O19: =ROUND(IF($I19>34840,($I19-34840)*0.128+((34840-5225)*0.091)-25.94,($I19-5225)*0.091)-25.94,0) -> 2574 | P19: =SUM(N19+O19) -> 7306 | Q19: =SUM(I19:O19) -> 41105
A20: 32795 | B20: 37 | I20: 32795 | N20: =ROUND(I20*0.14,0) -> 4591 | O20: =ROUND(IF($I20>34840,($I20-34840)*0.128+((34840-5225)*0.091)-25.94,($I20-5225)*0.091)-25.94,0) -> 2483 | P20: =SUM(N20+O20) -> 7074 | Q20: =SUM(I20:O20) -> 39869
A21: 31840 | B21: 36 | I21: 31840 | M21: =ROUND(I21*0.22,0) -> 7005 | N21: =ROUND(I21*0.14,0) -> 4458 | O21: =ROUND(IF($I21>34840,($I21-34840)*0.128+((34840-5225)*0.091)-25.94,($I21-5225)*0.091)-25.94,0) -> 2396 | Q21: NASPS = 41,241 & USS = 38,694
A22: 30913 | B22: 35 | I22: 30913 | M22: =ROUND(I22*0.22,0) -> 6801 | N22: =ROUND(I22*0.14,0) -> 4328 | O22: =ROUND(IF($I22>34840,($I22-34840)*0.128+((34840-5225)*0.091)-25.94,($I22-5225)*0.091)-25.94,0) -> 2312 | Q22: NASPS = 40,026 & USS = 37,463
A23: 30013 | B23: 34 | I23: 30013 | M23: =ROUND(I23*0.22,0) -> 6603 | N23: =ROUND(I23*0.14,0) -> 4202 | O23: =ROUND(IF($I23>34840,($I23-34840)*0.128+((34840-5225)*0.091)-25.94,($I23-5225)*0.091)-25.94,0) -> 2230 | Q23: NASPS = 38,846 & USS = 36,445
A24: 29138 | B24: 33 | I24: 29138 | M24: =ROUND(I24*0.22,0) -> 6410 | N24: =ROUND(I24*0.14,0) -> 4079 | O24: =ROUND(IF($I24>34840,($I24-34840)*0.128+((34840-5225)*0.091)-25.94,($I24-5225)*0.091)-25.94,0) -> 2150 | Q24: NASPS = 37,698 & USS = 35,387
A25: 28290 | B25: 32 | H25: 28290 | I25: 28290 | M25: =ROUND(I25*0.22,0) -> 6224 | N25: =ROUND(I25*0.14,0) -> 3961 | O25: =ROUND(IF($I25>34840,($I25-34840)*0.128+((34840-5225)*0.091)-25.94,($I25-5225)*0.091)-25.94,0) -> 2073 | Q25: NASPS = 36,587 & USS = 34,324
A26: 27465 | B26: 31 | H26: 27465 | I26: 27,465* | M26: =ROUND(H26*0.22,0) -> 6042 | N26: =ROUND(H26*0.14,0) -> 3845 | O26: =ROUND(IF($H26>34840,($H26-34840)*0.128+((34840-5225)*0.091)-25.94,($H26-5225)*0.091)-25.94,0) -> 1998 | Q26: NASPS = 35,505 & USS =33,308
A27: 26666 | B27: 30 | H27: 26666 | I27: 26,666* | M27: =ROUND(H27*0.22,0) -> 5867 | N27: =ROUND(H27*0.14,0) -> 3733 | O27: =ROUND(IF($H27>34840,($H27-34840)*0.128+((34840-5225)*0.091)-25.94,($H27-5225)*0.091)-25.94,0) -> 1925 | Q27: NASPS = 34,458& USS = 32,324
A28: 25889 | B28: 29 | H28: 25889 | I28: 25,889* | M28: =ROUND(H28*0.22,0) -> 5696 | N28: =ROUND(H28*0.14,0) -> 3624 | O28: =ROUND(IF($H28>34840,($H28-34840)*0.128+((34840-5225)*0.091)-25.94,($H28-5225)*0.091)-25.94,0) -> 1854 | Q28: NASPS = 33,439 & USS = 31,367
A29: 25135 | B29: 28 | H29: 25135 | M29: =ROUND(H29*0.22,0) -> 5530 | N29: =ROUND(H29*0.14,0) -> 3519 | O29: =ROUND(IF($H29>34840,($H29-34840)*0.128+((34840-5225)*0.091)-25.94,($H29-5225)*0.091)-25.94,0) -> 1786 | Q29: NASPS = 32,451 & USS = 30,440
A30: 24161 | B30: 27 | H30: 24402 | M30: =ROUND(H30*0.22,0) -> 5368 | N30: =ROUND(H30*0.14,0) -> 3416 | O30: =ROUND(IF($H30>34840,($H30-34840)*0.128+((34840-5225)*0.091)-25.94,($H30-5225)*0.091)-25.94,0) -> 1719 | Q30: NASPS = 31,489 & USS = 29,537
A31: 23692 | B31: 26 | H31: 23692 | M31: =ROUND(H31*0.22,0) -> 5212 | N31: =ROUND(H31*0.14,0) -> 3317 | O31: =ROUND(IF($H31>34840,($H31-34840)*0.128+((34840-5225)*0.091)-25.94,($H31-5225)*0.091)-25.94,0) -> 1655 | Q31: NASPS = 30,559 & USS = 28,664
A32: 23002 | B32: 25 | G32: 23002 | H32: 23002 | M32: =ROUND(G32*0.22,0) -> 5060 | N32: =ROUND(H32*0.14,0) -> 3220 | O32: =ROUND(IF($H32>34840,($H32-34840)*0.128+((34840-5225)*0.091)-25.94,($H32-5225)*0.091)-25.94,0) -> 1592 | Q32: NASPS = 29,654 & USS = 27,814
A33: 22332 | B33: 24 | G33: 22332 | M33: =ROUND(G33*0.22,0) -> 4913 | O33: =ROUND(IF($G33>34840,($G33-34840)*0.128+((34840-5225)*0.091)-25.94,($G33-5225)*0.091)-25.94,0) -> 1531 | P33: =SUM(M33+O33) -> 6444 | Q33: =SUM(G33:O33) -> 28776
A34: 21682 | B34: 23 | G34: 21682 | M34: =ROUND(G34*0.22,0) -> 4770 | O34: =ROUND(IF($G34>34840,($G34-34840)*0.128+((34840-5225)*0.091)-25.94,($G34-5225)*0.091)-25.94,0) -> 1472 | P34: =SUM(M34+O34) -> 6242 | Q34: =SUM(G34:O34) -> 27924
A35: 21050 | B35: 22 | G35: 21050 | M35: =ROUND(G35*0.22,0) -> 4631 | O35: =ROUND(IF($G35>34840,($G35-34840)*0.128+((34840-5225)*0.091)-25.94,($G35-5225)*0.091)-25.94,0) -> 1414 | P35: =SUM(M35+O35) -> 6045 | Q35: =SUM(G35:O35) -> 27095
A36: 20437 | B36: 21 | G36: 20437 | M36: =ROUND(G36*0.22,0) -> 4496 | O36: =ROUND(IF($G36>34840,($G36-34840)*0.128+((34840-5225)*0.091)-25.94,($G36-5225)*0.091)-25.94,0) -> 1358 | P36: =SUM(M36+O36) -> 5854 | Q36: =SUM(G36:O36) -> 26291
A37: 19862 | B37: 20 | G37: 19862 | M37: =ROUND(G37*0.22,0) -> 4370 | O37: =ROUND(IF($G37>34840,($G37-34840)*0.128+((34840-5225)*0.091)-25.94,($G37-5225)*0.091)-25.94,0) -> 1306 | P37: =SUM(M37+O37) -> 5676 | Q37: =SUM(G37:O37) -> 25538
A38: 19263 | B38: 19 | G38: 19263 | M38: =ROUND(G38*0.22,0) -> 4238 | O38: =ROUND(IF($G38>34840,($G38-34840)*0.128+((34840-5225)*0.091)-25.94,($G38-5225)*0.091)-25.94,0) -> 1252 | P38: =SUM(M38+O38) -> 5490 | Q38: =SUM(G38:O38) -> 24753
A39: 18703 | B39: 18 | F39: 18703 | G39: 18703 | M39: =ROUND(G39*0.22,0) -> 4115 | O39: =ROUND(IF($G39>34840,($G39-34840)*0.128+((34840-5225)*0.091)-25.94,($G39-5225)*0.091)-25.94,0) -> 1201 | P39: =SUM(M39+O39) -> 5316 | Q39: =SUM(G39:O39) -> 24019
A40: 18157 | B40: 17 | F40: 18157 | G40: 18157 | M40: =ROUND(G40*0.22,0) -> 3995 | O40: =ROUND(IF($G40>34840,($G40-34840)*0.128+((34840-5225)*0.091)-25.94,($G40-5225)*0.091)-25.94,0) -> 1151 | P40: =SUM(M40+O40) -> 5146 | Q40: =SUM(G40:O40) -> 23303
A41: 17636 | B41: 16 | F41: 17636 | G41: 17636 | M41: =ROUND(G41*0.22,0) -> 3880 | O41: =ROUND(IF($G41>34840,($G41-34840)*0.128+((34840-5225)*0.091)-25.94,($G41-5225)*0.091)-25.94,0) -> 1103 | P41: =SUM(M41+O41) -> 4983 | Q41: =SUM(G41:O41) -> 22619
A42: 17137 | B42: 15 | F42: 17137 | M42: =ROUND(F42*0.22,0) -> 3770 | O42: =ROUND(IF($F42>34840,($F42-34840)*0.128+((34840-5225)*0.091)-25.94,($F42-5225)*0.091)-25.94,0) -> 1058 | P42: =SUM(M42+O42) -> 4828 | Q42: =SUM(F42:O42) -> 21965
A43: 16643 | B43: 14 | F43: 16643 | M43: =ROUND(F43*0.22,0) -> 3661 | O43: =ROUND(IF($F43>34840,($F43-34840)*0.128+((34840-5225)*0.091)-25.94,($F43-5225)*0.091)-25.94,0) -> 1013 | P43: =SUM(M43+O43) -> 4674 | Q43: =SUM(F43:O43) -> 21317
A44: 16183 | B44: 13 | E44: 16183 | F44: 16183 | M44: =ROUND(F44*0.22,0) -> 3560 | O44: =ROUND(IF($F44>34840,($F44-34840)*0.128+((34840-5225)*0.091)-25.94,($F44-5225)*0.091)-25.94,0) -> 971 | P44: =SUM(M44+O44) -> 4531 | Q44: =SUM(F44:O44) -> 20714
A45: 15727 | B45: 12 | E45: 15727 | F45: 15727 | M45: =ROUND(F45*0.22,0) -> 3460 | O45: =ROUND(IF($F45>34840,($F45-34840)*0.128+((34840-5225)*0.091)-25.94,($F45-5225)*0.091)-25.94,0) -> 930 | P45: =SUM(M45+O45) -> 4390 | Q45: =SUM(F45:O45) -> 20117
A46: 15284 | B46: 11 | E46: 15284 | F46: 15284 | M46: =ROUND(F46*0.22,0) -> 3362 | O46: =ROUND(IF($F46>34840,($F46-34840)*0.128+((34840-5225)*0.091)-25.94,($F46-5225)*0.091)-25.94,0) -> 889 | P46: =SUM(M46+O46) -> 4251 | Q46: =SUM(F46:O46) -> 19535
A47: 14854 | B47: 10 | E47: 14854 | M47: =ROUND(E47*0.22,0) -> 3268 | O47: =ROUND(IF($E47>34840,($E47-34840)*0.128+((34840-5225)*0.091)-25.94,($E47-5225)*0.091)-25.94,0) -> 850 | P47: =SUM(M47+O47) -> 4118 | Q47: =SUM(E47:O47) -> 18972
A48: 14436 | B48: 9 | E48: 14436 | M48: =ROUND(E48*0.22,0) -> 3176 | O48: =ROUND(IF($E48>34840,($E48-34840)*0.128+((34840-5225)*0.091)-25.94,($E48-5225)*0.091)-25.94,0) -> 812 | P48: =SUM(M48+O48) -> 3988 | Q48: =SUM(E48:O48) -> 18424
A49: 14041 | B49: 8 | E49: 14041 | M49: =ROUND(E49*0.22,0) -> 3089 | O49: =ROUND(IF($E49>34840,($E49-34840)*0.128+((34840-5225)*0.091)-25.94,($E49-5225)*0.091)-25.94,0) -> 776 | P49: =SUM(M49+O49) -> 3865 | Q49: =SUM(E49:O49) -> 17906
A50: 13659 | B50: 7 | E50: 13659 | M50: =ROUND(E50*0.22,0) -> 3005 | O50: =ROUND(IF($E50>34840,($E50-34840)*0.128+((34840-5225)*0.091)-25.94,($E50-5225)*0.091)-25.94,0) -> 742 | P50: =SUM(M50+O50) -> 3747 | Q50: =SUM(E50:O50) -> 17406
A51: 13339 | B51: 6 | D51: 13339 | E51: 13339 | M51: =ROUND(E51*0.22,0) -> 2935 | O51: =ROUND(IF($E51>34840,($E51-34840)*0.128+((34840-5225)*0.091)-25.94,($E51-5225)*0.091)-25.94,0) -> 712 | P51: =SUM(M51+O51) -> 3647 | Q51: =SUM(E51:O51) -> 16986
A52: 12979 | B52: 5 | D52: 12979 | M52: =ROUND(D51*0.22,0) -> 2935 | O52: =ROUND(IF($D52>34840,($D52-34840)*0.128+((34840-5225)*0.091)-25.94,($D52-5225)*0.091)-25.94,0) -> 680 | P52: =SUM(M52+O52) -> 3615 | Q52: =SUM(D52:O52) -> 16594
A53: 12629 | B53: 4 | D53: 12629 | M53: =ROUND(D52*0.22,0) -> 2855 | O53: =ROUND(IF($D53>34840,($D53-34840)*0.128+((34840-5225)*0.091)-25.94,($D53-5225)*0.091)-25.94,0) -> 648 | P53: =SUM(M53+O53) -> 3503 | Q53: =SUM(D53:O53) -> 16132
A54: 12340 | B54: 3 | C54: 12340 | D54: 12340 | M54: =ROUND(D53*0.22,0) -> 2778 | O54: =ROUND(IF($D54>34840,($D54-34840)*0.128+((34840-5225)*0.091)-25.94,($D54-5225)*0.091)-25.94,0) -> 622 | P54: =SUM(M54+O54) -> 3400 | Q54: =SUM(D54:O54) -> 15740
A55: 12011 | B55: 2 | C55: 12011 | M55: =ROUND(C54*0.22,0) -> 2715 | O55: =ROUND(IF($C55>34840,($C55-34840)*0.128+((34840-5225)*0.091)-25.94,($C55-5225)*0.091)-25.94,0) -> 592 | P55: =SUM(M55+O55) -> 3307 | Q55: =SUM(C55:O55) -> 15318
A56: 11691 | B56: 1 | C56: 11691 | M56: =ROUND(C55*0.22,0) -> 2642 | O56: =ROUND(IF($C56>34840,($C56-34840)*0.128+((34840-5225)*0.091)-25.94,($C56-5225)*0.091)-25.94,0) -> 562 | P56: =SUM(M56+O56) -> 3204 | Q56: =SUM(C56:O56) -> 14895
B59: *Phasing arrangements in place until 1 August 2007