A1: CLINICAL ACADEMIC STAFF SALARY SCALES | J1: *** HR MUST specify the salary range for each appointment ***
C3: With effect from 1 April 2007: | K3: Grade 400 | M3: Clinical Lecturer
K4: Grade 401 | M4: Clinical Snr Lecturer
K5: Grade 402 | M5: Clinical Reader
C6: DELPHI | D6: UCEA | H6: Total | K6: Grade 407 | M6: Clinical Related Staff
C7: SPINAL | D7: SPINAL | E7: Basic | F7: Super | G7: Nat Ins | H7: Empl'rs | K7: Grade 408 | M7: Clinical University Teacher
A8: GRADE | C8: POINT | D8: POINT | E8: 39173 | F8: @ 14% | G8: 39173 | H8: Costs | I8: GROSS | K8: Grade 409 | M8: Senior Clinical University Teacher
E9: £ | F9: £ | G9: £ | H9: £ | I9: £ | K9: Grade 412 | M9: Clinical Research Fellow
A10: Clinical Lecturer | C10: 401 | D10: 1 | E10: 29580 | F10: =SUM(E10*14/100) -> 4141.2 | G10: =ROUND(IF($E10>34840,($E10-34840)*0.128+((34840-5225)*0.091)-25.94,($E10-5225)*0.091)-25.94,0) -> 2190 | H10: =F10+G10 -> 6331.2 | I10: =SUM(E10:G10) -> 35911.199999999997
A11: Grade 400 | C11: 402 | D11: 2 | E11: 31045 | F11: =SUM(E11*14/100) -> 4346.3 | G11: =ROUND(IF($E11>34840,($E11-34840)*0.128+((34840-5225)*0.091)-25.94,($E11-5225)*0.091)-25.94,0) -> 2324 | H11: =F11+G11 -> 6670.3 | I11: =SUM(E11:G11) -> 37715.3
A12: Clinical Research Fellow | C12: 403 | D12: 3 | E12: 32510 | F12: =SUM(E12*14/100) -> 4551.4 | G12: =ROUND(IF($E12>34840,($E12-34840)*0.128+((34840-5225)*0.091)-25.94,($E12-5225)*0.091)-25.94,0) -> 2457 | H12: =F12+G12 -> 7008.4 | I12: =SUM(E12:G12) -> 39518.400000000001
A13: Grade 412 | C13: 404 | D13: 4 | E13: 33975 | F13: =SUM(E13*14/100) -> 4756.5 | G13: =ROUND(IF($E13>34840,($E13-34840)*0.128+((34840-5225)*0.091)-25.94,($E13-5225)*0.091)-25.94,0) -> 2590 | H13: =F13+G13 -> 7346.5 | I13: =SUM(E13:G13) -> 41321.5
A14: Clinical University Teacher | C14: 405 | D14: 5 | E14: 35742 | F14: =SUM(E14*14/100) -> 5003.88 | G14: =ROUND(IF($E14>34840,($E14-34840)*0.128+((34840-5225)*0.091)-25.94,($E14-5225)*0.091)-25.94,0) -> 2759 | H14: =F14+G14 -> 7762.88 | I14: =SUM(E14:G14) -> 43504.88
A15: Grade 408 | C15: 406 | D15: 6 | E15: 37510 | F15: =SUM(E15*14/100) -> 5251.4 | G15: =ROUND(IF($E15>34840,($E15-34840)*0.128+((34840-5225)*0.091)-25.94,($E15-5225)*0.091)-25.94,0) -> 2985 | H15: =F15+G15 -> 8236.4 | I15: =SUM(E15:G15) -> 45746.400000000001
A16: (for others see RHS) | C16: 407 | D16: 7 | E16: 39278 | F16: =SUM(E16*14/100) -> 5498.92 | G16: =ROUND(IF($E16>34840,($E16-34840)*0.128+((34840-5225)*0.091)-25.94,($E16-5225)*0.091)-25.94,0) -> 3211 | H16: =F16+G16 -> 8709.92 | I16: =SUM(E16:G16) -> 47987.92 | K16: If promoted to post with honorary consultant status cease banding
C17: 408 | D17: 8 | E17: 41045 | F17: =SUM(E17*14/100) -> 5746.3 | G17: =ROUND(IF($E17>34840,($E17-34840)*0.128+((34840-5225)*0.091)-25.94,($E17-5225)*0.091)-25.94,0) -> 3437 | H17: =F17+G17 -> 9183.3 | I17: =SUM(E17:G17) -> 50228.3
C18: *409 | D18: 9 | E18: 42813 | F18: =SUM(E18*14/100) -> 5993.82 | G18: =ROUND(IF($E18>34840,($E18-34840)*0.128+((34840-5225)*0.091)-25.94,($E18-5225)*0.091)-25.94,0) -> 3664 | H18: =F18+G18 -> 9657.82 | I18: =SUM(E18:G18) -> 52470.82 | J18: *This point is maximum salary for banding calculation
C19: 410 | D19: 10 | E19: 47408 | F19: =SUM(E19*14/100) -> 6637.12 | G19: =ROUND(IF($E19>34840,($E19-34840)*0.128+((34840-5225)*0.091)-25.94,($E19-5225)*0.091)-25.94,0) -> 4252 | H19: =F19+G19 -> 10889.12 | I19: =SUM(E19:G19) -> 58297.120000000003
C20: 411 | D20: 11 | E20: 51219 | F20: =SUM(E20*14/100) -> 7170.66 | G20: =ROUND(IF($E20>34840,($E20-34840)*0.128+((34840-5225)*0.091)-25.94,($E20-5225)*0.091)-25.94,0) -> 4740 | H20: =F20+G20 -> 11910.66 | I20: =SUM(E20:G20) -> 63129.66
C21: **412 | D21: 12 | E21: 55029 | F21: =SUM(E21*14/100) -> 7704.06 | G21: =ROUND(IF($E21>34840,($E21-34840)*0.128+((34840-5225)*0.091)-25.94,($E21-5225)*0.091)-25.94,0) -> 5227 | H21: =F21+G21 -> 12931.06 | I21: =SUM(E21:G21) -> 67960.06 | J21: **This point was introduced on 1 April 2002 and relates only to
J22: dentists paid on clinical academic payscales
C23: 414 | D23: 13 | E23: 47408 | F23: =SUM(E23*14/100) -> 6637.12 | G23: =ROUND(IF($E23>34840,($E23-34840)*0.128+((34840-5225)*0.091)-25.94,($E23-5225)*0.091)-25.94,0) -> 4252 | H23: =F23+G23 -> 10889.12 | I23: =SUM(E23:G23) -> 58297.120000000003
A24: Clinical Senior Lecturer/Readers/ | C24: 415 | D24: 14 | E24: 51219 | F24: =SUM(E24*14/100) -> 7170.66 | G24: =ROUND(IF($E24>34840,($E24-34840)*0.128+((34840-5225)*0.091)-25.94,($E24-5225)*0.091)-25.94,0) -> 4740 | H24: =F24+G24 -> 11910.66 | I24: =SUM(E24:G24) -> 63129.66
A25: Senior Research Fellow/ | C25: 416 | D25: 15 | E25: 55029 | F25: =SUM(E25*14/100) -> 7704.06 | G25: =ROUND(IF($E25>34840,($E25-34840)*0.128+((34840-5225)*0.091)-25.94,($E25-5225)*0.091)-25.94,0) -> 5227 | H25: =F25+G25 -> 12931.06 | I25: =SUM(E25:G25) -> 67960.06
A26: Senior Clinical University Teacher | C26: ***417 | D26: 16 | E26: 58843 | F26: =SUM(E26*14/100) -> 8238.02 | G26: =ROUND(IF($E26>34840,($E26-34840)*0.128+((34840-5225)*0.091)-25.94,($E26-5225)*0.091)-25.94,0) -> 5715 | H26: =F26+G26 -> 13953.02 | I26: =SUM(E26:G26) -> 72796.02
A27: Grade 401/Grade 402/Grade 409 | C27: ***418 | D27: 17 | E27: 63703 | F27: =SUM(E27*14/100) -> 8918.42 | G27: =ROUND(IF($E27>34840,($E27-34840)*0.128+((34840-5225)*0.091)-25.94,($E27-5225)*0.091)-25.94,0) -> 6338 | H27: =F27+G27 -> 15256.42 | I27: =SUM(E27:G27) -> 78959.42
C28: ***419 | D28: 18 | E28: 67063 | F28: =SUM(E28*14/100) -> 9388.82 | G28: =ROUND(IF($E28>34840,($E28-34840)*0.128+((34840-5225)*0.091)-25.94,($E28-5225)*0.091)-25.94,0) -> 6768 | H28: =F28+G28 -> 16156.82 | I28: =SUM(E28:G28) -> 83219.82 | J28: *** These points have no equivalent NHS pay point and a £1000 increase
J29: has been applied in line with the increase in the other points
J30: on the Senior Lecturer/Reader Scale.