B1: Single Pay Spine for Academic and HE Support Staff, May 2008
L2: Super. @ 22% for NASPS | M2: Super. @ 14% for USS | N2: Nat Ins (ERS) April 2007 | O2: Total Empl'rs Costs | P2: Gross May 2008
A3: £ | B3: Spine Point | C3: £ | D3: £ | E3: £ | F3: £ | G3: £ | H3: £ | I3: £ | J3: £ | K3: £ | L3: £ | M3: £ | N3: £ | O3: £ | P3: £
C4: Grade 1 | D4: Grade 2 | E4: Grade 3 | F4: Grade 4 | G4: Grade 5 | H4: Grade 6 | I4: Grade 7 | J4: Grade 8 | K4: Grade 9
A5: 54207 | B5: 52 | K5: 54207 | M5: =ROUND(K5*0.14,0) -> 7589 | N5: =ROUND(IF($K5>34840,($K5-34840)*0.128+((34840-5225)*0.091)-25.94,($K5-5225)*0.091)-25.94,0) -> 5122 | O5: =SUM(M5+N5) -> 12711 | P5: =SUM(K5:N5) -> 66918
A6: 52628 | B6: 51 | K6: 52628 | M6: =ROUND(K6*0.14,0) -> 7368 | N6: =ROUND(IF($K6>34840,($K6-34840)*0.128+((34840-5225)*0.091)-25.94,($K6-5225)*0.091)-25.94,0) -> 4920 | O6: =SUM(M6+N6) -> 12288 | P6: =SUM(K6:N6) -> 64916
A7: 51095 | B7: 50 | K7: 51095 | M7: =ROUND(K7*0.14,0) -> 7153 | N7: =ROUND(IF($K7>34840,($K7-34840)*0.128+((34840-5225)*0.091)-25.94,($K7-5225)*0.091)-25.94,0) -> 4724 | O7: =SUM(M7+N7) -> 11877 | P7: =SUM(K7:N7) -> 62972
A8: 49606 | B8: 49 | K8: 49606 | M8: =ROUND(K8*0.14,0) -> 6945 | N8: =ROUND(IF($K8>34840,($K8-34840)*0.128+((34840-5225)*0.091)-25.94,($K8-5225)*0.091)-25.94,0) -> 4533 | O8: =SUM(M8+N8) -> 11478 | P8: =SUM(K8:N8) -> 61084
A9: 48161 | B9: 48 | K9: 48161 | M9: =ROUND(K9*0.14,0) -> 6743 | N9: =ROUND(IF($K9>34840,($K9-34840)*0.128+((34840-5225)*0.091)-25.94,($K9-5225)*0.091)-25.94,0) -> 4348 | O9: =SUM(M9+N9) -> 11091 | P9: =SUM(K9:N9) -> 59252
A10: 46759 | B10: 47 | J10: 46759 | K10: 46759 | M10: =ROUND(K10*0.14,0) -> 6546 | N10: =ROUND(IF($K10>34840,($K10-34840)*0.128+((34840-5225)*0.091)-25.94,($K10-5225)*0.091)-25.94,0) -> 4169 | O10: =SUM(M10+N10) -> 10715 | P10: =SUM(K10:N10) -> 57474
A11: 45397 | B11: 46 | J11: 45397 | K11: 45397 | M11: =ROUND(K11*0.14,0) -> 6356 | N11: =ROUND(IF($K11>34840,($K11-34840)*0.128+((34840-5225)*0.091)-25.94,($K11-5225)*0.091)-25.94,0) -> 3994 | O11: =SUM(M11+N11) -> 10350 | P11: =SUM(K11:N11) -> 55747
A12: 44074 | B12: 45 | J12: 44074 | K12: 44074 | M12: =ROUND(K12*0.14,0) -> 6170 | N12: =ROUND(IF($K12>34840,($K12-34840)*0.128+((34840-5225)*0.091)-25.94,($K12-5225)*0.091)-25.94,0) -> 3825 | O12: =SUM(M12+N12) -> 9995 | P12: =SUM(K12:N12) -> 54069
A13: 42791 | B13: 44 | J13: 42791 | M13: =ROUND(J13*0.14,0) -> 5991 | N13: =ROUND(IF($J13>34840,($J13-34840)*0.128+((34840-5225)*0.091)-25.94,($J13-5225)*0.091)-25.94,0) -> 3661 | O13: =SUM(M13+N13) -> 9652 | P13: =SUM(J13:N13) -> 52443
A14: 41545 | B14: 43 | J14: 41545 | M14: =ROUND(J14*0.14,0) -> 5816 | N14: =ROUND(IF($J14>34840,($J14-34840)*0.128+((34840-5225)*0.091)-25.94,($J14-5225)*0.091)-25.94,0) -> 3501 | O14: =SUM(M14+N14) -> 9317 | P14: =SUM(J14:N14) -> 50862
A15: 40334 | B15: 42 | J15: 40334 | M15: =ROUND(J15*0.14,0) -> 5647 | N15: =ROUND(IF($J15>34840,($J15-34840)*0.128+((34840-5225)*0.091)-25.94,($J15-5225)*0.091)-25.94,0) -> 3346 | O15: =SUM(M15+N15) -> 8993 | P15: =SUM(J15:N15) -> 49327
A16: 39160 | B16: 41 | J16: 39160 | M16: =ROUND(J16*0.14,0) -> 5482 | N16: =ROUND(IF($J16>34840,($J16-34840)*0.128+((34840-5225)*0.091)-25.94,($J16-5225)*0.091)-25.94,0) -> 3196 | O16: =SUM(M16+N16) -> 8678 | P16: =SUM(J16:N16) -> 47838
A17: 38019 | B17: 40 | J17: 38019 | M17: =ROUND(J17*0.14,0) -> 5323 | N17: =ROUND(IF($J17>34840,($J17-34840)*0.128+((34840-5225)*0.091)-25.94,($J17-5225)*0.091)-25.94,0) -> 3050 | O17: =SUM(M17+N17) -> 8373 | P17: =SUM(J17:N17) -> 46392
A18: 36912 | B18: 39 | I18: 36912 | J18: 36912 | M18: =ROUND(J18*0.14,0) -> 5168 | N18: =ROUND(IF($J18>34840,($J18-34840)*0.128+((34840-5225)*0.091)-25.94,($J18-5225)*0.091)-25.94,0) -> 2908 | O18: =SUM(M18+N18) -> 8076 | P18: =SUM(J18:N18) -> 44988
A19: 35858 | B19: 38 | I19: 35858 | M19: =ROUND(I19*0.14,0) -> 5020 | N19: =ROUND(IF($I19>34840,($I19-34840)*0.128+((34840-5225)*0.091)-25.94,($I19-5225)*0.091)-25.94,0) -> 2773 | O19: =SUM(M19+N19) -> 7793 | P19: =SUM(I19:N19) -> 43651
A20: 34793 | B20: 37 | I20: 34793 | M20: =ROUND(I20*0.14,0) -> 4871 | N20: =ROUND(IF($I20>34840,($I20-34840)*0.128+((34840-5225)*0.091)-25.94,($I20-5225)*0.091)-25.94,0) -> 2665 | O20: =SUM(M20+N20) -> 7536 | P20: =SUM(I20:N20) -> 42329
A21: 33780 | B21: 36 | I21: 33780 | M21: =ROUND(I21*0.14,0) -> 4729 | N21: =ROUND(IF($I21>34840,($I21-34840)*0.128+((34840-5225)*0.091)-25.94,($I21-5225)*0.091)-25.94,0) -> 2573 | O21: =SUM(M21+N21) -> 7302 | P21: =SUM(I21:N21) -> 41082
A22: 32795 | B22: 35 | I22: 32795 | M22: =ROUND(I22*0.14,0) -> 4591 | N22: =ROUND(IF($I22>34840,($I22-34840)*0.128+((34840-5225)*0.091)-25.94,($I22-5225)*0.091)-25.94,0) -> 2483 | O22: =SUM(M22+N22) -> 7074 | P22: =SUM(I22:N22) -> 39869
A23: 31840 | B23: 34 | I23: 31840 | M23: =ROUND(I23*0.14,0) -> 4458 | N23: =ROUND(IF($I23>34840,($I23-34840)*0.128+((34840-5225)*0.091)-25.94,($I23-5225)*0.091)-25.94,0) -> 2396 | O23: =SUM(M23+N23) -> 6854 | P23: =SUM(I23:N23) -> 38694
A24: 30912 | B24: 33 | I24: 30912 | M24: =ROUND(I24*0.14,0) -> 4328 | N24: =ROUND(IF($I24>34840,($I24-34840)*0.128+((34840-5225)*0.091)-25.94,($I24-5225)*0.091)-25.94,0) -> 2312 | O24: =SUM(M24+N24) -> 6640 | P24: =SUM(I24:N24) -> 37552
A25: 30013 | B25: 32 | H25: 30013 | I25: 30013 | M25: =ROUND(I25*0.14,0) -> 4202 | N25: =ROUND(IF($I25>34840,($I25-34840)*0.128+((34840-5225)*0.091)-25.94,($I25-5225)*0.091)-25.94,0) -> 2230 | O25: =SUM(M25+N25) -> 6432 | P25: =SUM(I25:N25) -> 36445
A26: 29138 | B26: 31 | H26: 29138 | M26: =ROUND(H26*0.14,0) -> 4079 | N26: =ROUND(IF($H26>34840,($H26-34840)*0.128+((34840-5225)*0.091)-25.94,($H26-5225)*0.091)-25.94,0) -> 2150 | O26: =SUM(M26+N26) -> 6229 | P26: =SUM(H26:N26) -> 35367
A27: 28290 | B27: 30 | H27: 28290 | M27: =ROUND(H27*0.14,0) -> 3961 | N27: =ROUND(IF($H27>34840,($H27-34840)*0.128+((34840-5225)*0.091)-25.94,($H27-5225)*0.091)-25.94,0) -> 2073 | O27: =SUM(M27+N27) -> 6034 | P27: =SUM(H27:N27) -> 34324
A28: 27466 | B28: 29 | H28: 27466 | M28: =ROUND(H28*0.14,0) -> 3845 | N28: =ROUND(IF($H28>34840,($H28-34840)*0.128+((34840-5225)*0.091)-25.94,($H28-5225)*0.091)-25.94,0) -> 1998 | O28: =SUM(M28+N28) -> 5843 | P28: =SUM(H28:N28) -> 33309
A29: 26665 | B29: 28 | H29: 26665 | M29: =ROUND(H29*0.14,0) -> 3733 | N29: =ROUND(IF($H29>34840,($H29-34840)*0.128+((34840-5225)*0.091)-25.94,($H29-5225)*0.091)-25.94,0) -> 1925 | O29: =SUM(M29+N29) -> 5658 | P29: =SUM(H29:N29) -> 32323
A30: 25888 | B30: 27 | H30: 25888 | M30: =ROUND(H30*0.14,0) -> 3624 | N30: =ROUND(IF($H30>34840,($H30-34840)*0.128+((34840-5225)*0.091)-25.94,($H30-5225)*0.091)-25.94,0) -> 1854 | O30: =SUM(M30+N30) -> 5478 | P30: =SUM(H30:N30) -> 31366
A31: 25135 | B31: 26 | H31: 25135 | M31: =ROUND(H31*0.14,0) -> 3519 | N31: =ROUND(IF($H31>34840,($H31-34840)*0.128+((34840-5225)*0.091)-25.94,($H31-5225)*0.091)-25.94,0) -> 1786 | O31: =SUM(M31+N31) -> 5305 | P31: =SUM(H31:N31) -> 30440
A32: 24403 | B32: 25 | G32: 24403 | H32: 24403 | L32: =ROUND(G32*0.22,0) -> 5369 | M32: =ROUND(H32*0.14,0) -> 3416 | N32: =ROUND(IF($H32>34840,($H32-34840)*0.128+((34840-5225)*0.091)-25.94,($H32-5225)*0.091)-25.94,0) -> 1719 | P32: NASPS = 31,491 & USS = 29,538
A33: 23692 | B33: 24 | G33: 23692 | L33: =ROUND(G33*0.22,0) -> 5212 | N33: =ROUND(IF($G33>34840,($G33-34840)*0.128+((34840-5225)*0.091)-25.94,($G33-5225)*0.091)-25.94,0) -> 1655 | O33: =SUM(L33+N33) -> 6867 | P33: =SUM(G33:N33) -> 30559
A34: 23002 | B34: 23 | G34: 23002 | L34: =ROUND(G34*0.22,0) -> 5060 | N34: =ROUND(IF($G34>34840,($G34-34840)*0.128+((34840-5225)*0.091)-25.94,($G34-5225)*0.091)-25.94,0) -> 1592 | O34: =SUM(L34+N34) -> 6652 | P34: =SUM(G34:N34) -> 29654
A35: 22332 | B35: 22 | G35: 22332 | L35: =ROUND(G35*0.22,0) -> 4913 | N35: =ROUND(IF($G35>34840,($G35-34840)*0.128+((34840-5225)*0.091)-25.94,($G35-5225)*0.091)-25.94,0) -> 1531 | O35: =SUM(L35+N35) -> 6444 | P35: =SUM(G35:N35) -> 28776
A36: 21681 | B36: 21 | G36: 21681 | L36: =ROUND(G36*0.22,0) -> 4770 | N36: =ROUND(IF($G36>34840,($G36-34840)*0.128+((34840-5225)*0.091)-25.94,($G36-5225)*0.091)-25.94,0) -> 1472 | O36: =SUM(L36+N36) -> 6242 | P36: =SUM(G36:N36) -> 27923
A37: 21072 | B37: 20 | G37: 21072 | L37: =ROUND(G37*0.22,0) -> 4636 | N37: =ROUND(IF($G37>34840,($G37-34840)*0.128+((34840-5225)*0.091)-25.94,($G37-5225)*0.091)-25.94,0) -> 1416 | O37: =SUM(L37+N37) -> 6052 | P37: =SUM(G37:N37) -> 27124
A38: 20436 | B38: 19 | G38: 20436 | L38: =ROUND(G38*0.22,0) -> 4496 | N38: =ROUND(IF($G38>34840,($G38-34840)*0.128+((34840-5225)*0.091)-25.94,($G38-5225)*0.091)-25.94,0) -> 1358 | O38: =SUM(L38+N38) -> 5854 | P38: =SUM(G38:N38) -> 26290
A39: 19841 | B39: 18 | F39: 19841 | G39: 19841 | L39: =ROUND(G39*0.22,0) -> 4365 | N39: =ROUND(IF($G39>34840,($G39-34840)*0.128+((34840-5225)*0.091)-25.94,($G39-5225)*0.091)-25.94,0) -> 1304 | O39: =SUM(L39+N39) -> 5669 | P39: =SUM(G39:N39) -> 25510
A40: 19263 | B40: 17 | F40: 19263 | G40: 19263 | L40: =ROUND(G40*0.22,0) -> 4238 | N40: =ROUND(IF($G40>34840,($G40-34840)*0.128+((34840-5225)*0.091)-25.94,($G40-5225)*0.091)-25.94,0) -> 1252 | O40: =SUM(L40+N40) -> 5490 | P40: =SUM(G40:N40) -> 24753
A41: 18710 | B41: 16 | F41: 18710 | G41: 18710 | L41: =ROUND(G41*0.22,0) -> 4116 | N41: =ROUND(IF($G41>34840,($G41-34840)*0.128+((34840-5225)*0.091)-25.94,($G41-5225)*0.091)-25.94,0) -> 1201 | O41: =SUM(L41+N41) -> 5317 | P41: =SUM(G41:N41) -> 24027
A42: 18180 | B42: 15 | F42: 18180 | L42: =ROUND(F42*0.22,0) -> 4000 | N42: =ROUND(IF($F42>34840,($F42-34840)*0.128+((34840-5225)*0.091)-25.94,($F42-5225)*0.091)-25.94,0) -> 1153 | O42: =SUM(L42+N42) -> 5153 | P42: =SUM(F42:N42) -> 23333
A43: 17667 | B43: 14 | F43: 17667 | L43: =ROUND(F43*0.22,0) -> 3887 | N43: =ROUND(IF($F43>34840,($F43-34840)*0.128+((34840-5225)*0.091)-25.94,($F43-5225)*0.091)-25.94,0) -> 1106 | O43: =SUM(L43+N43) -> 4993 | P43: =SUM(F43:N43) -> 22660
A44: 17169 | B44: 13 | E44: 17169 | F44: 17169 | L44: =ROUND(F44*0.22,0) -> 3777 | N44: =ROUND(IF($F44>34840,($F44-34840)*0.128+((34840-5225)*0.091)-25.94,($F44-5225)*0.091)-25.94,0) -> 1061 | O44: =SUM(L44+N44) -> 4838 | P44: =SUM(F44:N44) -> 22007
A45: 16684 | B45: 12 | E45: 16684 | F45: 16684 | L45: =ROUND(F45*0.22,0) -> 3670 | N45: =ROUND(IF($F45>34840,($F45-34840)*0.128+((34840-5225)*0.091)-25.94,($F45-5225)*0.091)-25.94,0) -> 1017 | O45: =SUM(L45+N45) -> 4687 | P45: =SUM(F45:N45) -> 21371
A46: 16215 | B46: 11 | E46: 16215 | F46: 16215 | L46: =ROUND(F46*0.22,0) -> 3567 | N46: =ROUND(IF($F46>34840,($F46-34840)*0.128+((34840-5225)*0.091)-25.94,($F46-5225)*0.091)-25.94,0) -> 974 | O46: =SUM(L46+N46) -> 4541 | P46: =SUM(F46:N46) -> 20756
A47: 15759 | B47: 10 | E47: 15759 | L47: =ROUND(E47*0.22,0) -> 3467 | N47: =ROUND(IF($E47>34840,($E47-34840)*0.128+((34840-5225)*0.091)-25.94,($E47-5225)*0.091)-25.94,0) -> 933 | O47: =SUM(L47+N47) -> 4400 | P47: =SUM(E47:N47) -> 20159
A48: 15315 | B48: 9 | E48: 15315 | L48: =ROUND(E48*0.22,0) -> 3369 | N48: =ROUND(IF($E48>34840,($E48-34840)*0.128+((34840-5225)*0.091)-25.94,($E48-5225)*0.091)-25.94,0) -> 892 | O48: =SUM(L48+N48) -> 4261 | P48: =SUM(E48:N48) -> 19576
A49: 14896 | B49: 8 | E49: 14896 | L49: =ROUND(E49*0.22,0) -> 3277 | N49: =ROUND(IF($E49>34840,($E49-34840)*0.128+((34840-5225)*0.091)-25.94,($E49-5225)*0.091)-25.94,0) -> 854 | O49: =SUM(L49+N49) -> 4131 | P49: =SUM(E49:N49) -> 19027
A50: 14491 | B50: 7 | E50: 14491 | L50: =ROUND(E50*0.22,0) -> 3188 | N50: =ROUND(IF($E50>34840,($E50-34840)*0.128+((34840-5225)*0.091)-25.94,($E50-5225)*0.091)-25.94,0) -> 817 | O50: =SUM(L50+N50) -> 4005 | P50: =SUM(E50:N50) -> 18496
A51: 14159 | B51: 6 | D51: 14159 | E51: 14159 | L51: =ROUND(E51*0.22,0) -> 3115 | N51: =ROUND(IF($E51>34840,($E51-34840)*0.128+((34840-5225)*0.091)-25.94,($E51-5225)*0.091)-25.94,0) -> 787 | O51: =SUM(L51+N51) -> 3902 | P51: =SUM(E51:N51) -> 18061
A52: 13788 | B52: 5 | D52: 13788 | L52: =ROUND(D51*0.22,0) -> 3115 | N52: =ROUND(IF($D52>34840,($D52-34840)*0.128+((34840-5225)*0.091)-25.94,($D52-5225)*0.091)-25.94,0) -> 753 | O52: =SUM(L52+N52) -> 3868 | P52: =SUM(D52:N52) -> 17656
A53: 13428 | B53: 4 | D53: 13428 | L53: =ROUND(D52*0.22,0) -> 3033 | N53: =ROUND(IF($D53>34840,($D53-34840)*0.128+((34840-5225)*0.091)-25.94,($D53-5225)*0.091)-25.94,0) -> 721 | O53: =SUM(L53+N53) -> 3754 | P53: =SUM(D53:N53) -> 17182
A54: 13130 | B54: 3 | C54: 13130 | D54: 13130 | L54: =ROUND(D53*0.22,0) -> 2954 | N54: =ROUND(IF($D54>34840,($D54-34840)*0.128+((34840-5225)*0.091)-25.94,($D54-5225)*0.091)-25.94,0) -> 693 | O54: =SUM(L54+N54) -> 3647 | P54: =SUM(D54:N54) -> 16777
A55: 12791 | B55: 2 | C55: 12791 | L55: =ROUND(C54*0.22,0) -> 2889 | N55: =ROUND(IF($C55>34840,($C55-34840)*0.128+((34840-5225)*0.091)-25.94,($C55-5225)*0.091)-25.94,0) -> 663 | O55: =SUM(L55+N55) -> 3552 | P55: =SUM(C55:N55) -> 16343
A56: 12461 | B56: 1 | C56: 12461 | L56: =ROUND(C55*0.22,0) -> 2814 | N56: =ROUND(IF($C56>34840,($C56-34840)*0.128+((34840-5225)*0.091)-25.94,($C56-5225)*0.091)-25.94,0) -> 633 | O56: =SUM(L56+N56) -> 3447 | P56: =SUM(C56:N56) -> 15908