B1: Single Pay Spine for Academic and HE Support Staff, August 2007
L2: Super. @ 22% for NASPS | M2: Super. @ 14% for USS | N2: Nat Ins (ERS) April 07 | O2: Total Empl'rs Costs | P2: Gross August 2007
A3: £ | B3: Spine Point | C3: £ | D3: £ | E3: £ | F3: £ | G3: £ | H3: £ | I3: £ | J3: £ | K3: £ | L3: £ | M3: £ | N3: £ | O3: £ | P3: £
C4: Grade 1 | D4: Grade 2 | E4: Grade 3 | F4: Grade 4 | G4: Grade 5 | H4: Grade 6 | I4: Grade 7 | J4: Grade 8 | K4: Grade 9
A5: 52628 | B5: 52 | K5: 52628 | M5: =ROUND(K5*0.14,0) -> 7368 | N5: =ROUND(IF($K5>34840,($K5-34840)*0.128+((34840-5225)*0.091)-25.94,($K5-5225)*0.091)-25.94,0) -> 4920 | O5: =SUM(M5+N5) -> 12288 | P5: =SUM(K5:N5) -> 64916
A6: 51095 | B6: 51 | K6: 51095 | M6: =ROUND(K6*0.14,0) -> 7153 | N6: =ROUND(IF($K6>34840,($K6-34840)*0.128+((34840-5225)*0.091)-25.94,($K6-5225)*0.091)-25.94,0) -> 4724 | O6: =SUM(M6+N6) -> 11877 | P6: =SUM(K6:N6) -> 62972
A7: 49607 | B7: 50 | K7: 49607 | M7: =ROUND(K7*0.14,0) -> 6945 | N7: =ROUND(IF($K7>34840,($K7-34840)*0.128+((34840-5225)*0.091)-25.94,($K7-5225)*0.091)-25.94,0) -> 4533 | O7: =SUM(M7+N7) -> 11478 | P7: =SUM(K7:N7) -> 61085
A8: 48161 | B8: 49 | K8: 48161 | M8: =ROUND(K8*0.14,0) -> 6743 | N8: =ROUND(IF($K8>34840,($K8-34840)*0.128+((34840-5225)*0.091)-25.94,($K8-5225)*0.091)-25.94,0) -> 4348 | O8: =SUM(M8+N8) -> 11091 | P8: =SUM(K8:N8) -> 59252
A9: 46759 | B9: 48 | K9: 46759 | M9: =ROUND(K9*0.14,0) -> 6546 | N9: =ROUND(IF($K9>34840,($K9-34840)*0.128+((34840-5225)*0.091)-25.94,($K9-5225)*0.091)-25.94,0) -> 4169 | O9: =SUM(M9+N9) -> 10715 | P9: =SUM(K9:N9) -> 57474
A10: 45397 | B10: 47 | J10: 45397 | K10: 45397 | M10: =ROUND(K10*0.14,0) -> 6356 | N10: =ROUND(IF($K10>34840,($K10-34840)*0.128+((34840-5225)*0.091)-25.94,($K10-5225)*0.091)-25.94,0) -> 3994 | O10: =SUM(M10+N10) -> 10350 | P10: =SUM(K10:N10) -> 55747
A11: 44074 | B11: 46 | J11: 44074 | K11: 44074 | M11: =ROUND(K11*0.14,0) -> 6170 | N11: =ROUND(IF($K11>34840,($K11-34840)*0.128+((34840-5225)*0.091)-25.94,($K11-5225)*0.091)-25.94,0) -> 3825 | O11: =SUM(M11+N11) -> 9995 | P11: =SUM(K11:N11) -> 54069
A12: 42791 | B12: 45 | J12: 42791 | K12: 42791 | M12: =ROUND(K12*0.14,0) -> 5991 | N12: =ROUND(IF($K12>34840,($K12-34840)*0.128+((34840-5225)*0.091)-25.94,($K12-5225)*0.091)-25.94,0) -> 3661 | O12: =SUM(M12+N12) -> 9652 | P12: =SUM(K12:N12) -> 52443
A13: 41545 | B13: 44 | J13: 41545 | M13: =ROUND(J13*0.14,0) -> 5816 | N13: =ROUND(IF($J13>34840,($J13-34840)*0.128+((34840-5225)*0.091)-25.94,($J13-5225)*0.091)-25.94,0) -> 3501 | O13: =SUM(M13+N13) -> 9317 | P13: =SUM(J13:N13) -> 50862
A14: 40335 | B14: 43 | J14: 40335 | M14: =ROUND(J14*0.14,0) -> 5647 | N14: =ROUND(IF($J14>34840,($J14-34840)*0.128+((34840-5225)*0.091)-25.94,($J14-5225)*0.091)-25.94,0) -> 3346 | O14: =SUM(M14+N14) -> 8993 | P14: =SUM(J14:N14) -> 49328
A15: 39159 | B15: 42 | J15: 39159 | M15: =ROUND(J15*0.14,0) -> 5482 | N15: =ROUND(IF($J15>34840,($J15-34840)*0.128+((34840-5225)*0.091)-25.94,($J15-5225)*0.091)-25.94,0) -> 3196 | O15: =SUM(M15+N15) -> 8678 | P15: =SUM(J15:N15) -> 47837
A16: 38019 | B16: 41 | J16: 38019 | M16: =ROUND(J16*0.14,0) -> 5323 | N16: =ROUND(IF($J16>34840,($J16-34840)*0.128+((34840-5225)*0.091)-25.94,($J16-5225)*0.091)-25.94,0) -> 3050 | O16: =SUM(M16+N16) -> 8373 | P16: =SUM(J16:N16) -> 46392
A17: 36911 | B17: 40 | J17: 36911 | M17: =ROUND(J17*0.14,0) -> 5168 | N17: =ROUND(IF($J17>34840,($J17-34840)*0.128+((34840-5225)*0.091)-25.94,($J17-5225)*0.091)-25.94,0) -> 2908 | O17: =SUM(M17+N17) -> 8076 | P17: =SUM(J17:N17) -> 44987
A18: 35837 | B18: 39 | I18: 35837 | J18: 35837 | M18: =ROUND(J18*0.14,0) -> 5017 | N18: =ROUND(IF($J18>34840,($J18-34840)*0.128+((34840-5225)*0.091)-25.94,($J18-5225)*0.091)-25.94,0) -> 2771 | O18: =SUM(M18+N18) -> 7788 | P18: =SUM(J18:N18) -> 43625
A19: 34813 | B19: 38 | I19: 34813 | M19: =ROUND(I19*0.14,0) -> 4874 | N19: =ROUND(IF($I19>34840,($I19-34840)*0.128+((34840-5225)*0.091)-25.94,($I19-5225)*0.091)-25.94,0) -> 2667 | O19: =SUM(M19+N19) -> 7541 | P19: =SUM(I19:N19) -> 42354
A20: 33779 | B20: 37 | I20: 33779 | M20: =ROUND(I20*0.14,0) -> 4729 | N20: =ROUND(IF($I20>34840,($I20-34840)*0.128+((34840-5225)*0.091)-25.94,($I20-5225)*0.091)-25.94,0) -> 2572 | O20: =SUM(M20+N20) -> 7301 | P20: =SUM(I20:N20) -> 41080
A21: 32796 | B21: 36 | I21: 32796 | M21: =ROUND(I21*0.14,0) -> 4591 | N21: =ROUND(IF($I21>34840,($I21-34840)*0.128+((34840-5225)*0.091)-25.94,($I21-5225)*0.091)-25.94,0) -> 2483 | O21: =SUM(M21+N21) -> 7074 | P21: =SUM(I21:N21) -> 39870
A22: 31840 | B22: 35 | I22: 31840 | M22: =ROUND(I22*0.14,0) -> 4458 | N22: =ROUND(IF($I22>34840,($I22-34840)*0.128+((34840-5225)*0.091)-25.94,($I22-5225)*0.091)-25.94,0) -> 2396 | O22: =SUM(M22+N22) -> 6854 | P22: =SUM(I22:N22) -> 38694
A23: 30913 | B23: 34 | I23: 30913 | M23: =ROUND(I23*0.14,0) -> 4328 | N23: =ROUND(IF($I23>34840,($I23-34840)*0.128+((34840-5225)*0.091)-25.94,($I23-5225)*0.091)-25.94,0) -> 2312 | O23: =SUM(M23+N23) -> 6640 | P23: =SUM(I23:N23) -> 37553
A24: 30012 | B24: 33 | I24: 30012 | M24: =ROUND(I24*0.14,0) -> 4202 | N24: =ROUND(IF($I24>34840,($I24-34840)*0.128+((34840-5225)*0.091)-25.94,($I24-5225)*0.091)-25.94,0) -> 2230 | O24: =SUM(M24+N24) -> 6432 | P24: =SUM(I24:N24) -> 36444
A25: 29139 | B25: 32 | H25: 29139 | I25: 29139 | M25: =ROUND(I25*0.14,0) -> 4079 | N25: =ROUND(IF($I25>34840,($I25-34840)*0.128+((34840-5225)*0.091)-25.94,($I25-5225)*0.091)-25.94,0) -> 2150 | O25: =SUM(M25+N25) -> 6229 | P25: =SUM(I25:N25) -> 35368
A26: 28289 | B26: 31 | H26: 28289 | M26: =ROUND(H26*0.14,0) -> 3960 | N26: =ROUND(IF($H26>34840,($H26-34840)*0.128+((34840-5225)*0.091)-25.94,($H26-5225)*0.091)-25.94,0) -> 2073 | O26: =SUM(M26+N26) -> 6033 | P26: =SUM(H26:N26) -> 34322
A27: 27466 | B27: 30 | H27: 27466 | M27: =ROUND(H27*0.14,0) -> 3845 | N27: =ROUND(IF($H27>34840,($H27-34840)*0.128+((34840-5225)*0.091)-25.94,($H27-5225)*0.091)-25.94,0) -> 1998 | O27: =SUM(M27+N27) -> 5843 | P27: =SUM(H27:N27) -> 33309
A28: 26666 | B28: 29 | H28: 26666 | M28: =ROUND(H28*0.14,0) -> 3733 | N28: =ROUND(IF($H28>34840,($H28-34840)*0.128+((34840-5225)*0.091)-25.94,($H28-5225)*0.091)-25.94,0) -> 1925 | O28: =SUM(M28+N28) -> 5658 | P28: =SUM(H28:N28) -> 32324
A29: 25889 | B29: 28 | H29: 25889 | M29: =ROUND(H29*0.14,0) -> 3624 | N29: =ROUND(IF($H29>34840,($H29-34840)*0.128+((34840-5225)*0.091)-25.94,($H29-5225)*0.091)-25.94,0) -> 1854 | O29: =SUM(M29+N29) -> 5478 | P29: =SUM(H29:N29) -> 31367
A30: 25134 | B30: 27 | H30: 25134 | M30: =ROUND(H30*0.14,0) -> 3519 | N30: =ROUND(IF($H30>34840,($H30-34840)*0.128+((34840-5225)*0.091)-25.94,($H30-5225)*0.091)-25.94,0) -> 1786 | O30: =SUM(M30+N30) -> 5305 | P30: =SUM(H30:N30) -> 30439
A31: 24403 | B31: 26 | H31: 24403 | M31: =ROUND(H31*0.14,0) -> 3416 | N31: =ROUND(IF($H31>34840,($H31-34840)*0.128+((34840-5225)*0.091)-25.94,($H31-5225)*0.091)-25.94,0) -> 1719 | O31: =SUM(M31+N31) -> 5135 | P31: =SUM(H31:N31) -> 29538
A32: 23692 | B32: 25 | G32: 23692 | H32: 23692 | L32: =ROUND(G32*0.22,0) -> 5212 | M32: =ROUND(H32*0.14,0) -> 3317 | N32: =ROUND(IF($H32>34840,($H32-34840)*0.128+((34840-5225)*0.091)-25.94,($H32-5225)*0.091)-25.94,0) -> 1655 | P32: NASPS = 30,559 & USS = 28,664
A33: 23002 | B33: 24 | G33: 23002 | L33: =ROUND(G33*0.22,0) -> 5060 | N33: =ROUND(IF($G33>34840,($G33-34840)*0.128+((34840-5225)*0.091)-25.94,($G33-5225)*0.091)-25.94,0) -> 1592 | O33: =SUM(L33+N33) -> 6652 | P33: =SUM(G33:N33) -> 29654
A34: 22332 | B34: 23 | G34: 22332 | L34: =ROUND(G34*0.22,0) -> 4913 | N34: =ROUND(IF($G34>34840,($G34-34840)*0.128+((34840-5225)*0.091)-25.94,($G34-5225)*0.091)-25.94,0) -> 1531 | O34: =SUM(L34+N34) -> 6444 | P34: =SUM(G34:N34) -> 28776
A35: 21682 | B35: 22 | G35: 21682 | L35: =ROUND(G35*0.22,0) -> 4770 | N35: =ROUND(IF($G35>34840,($G35-34840)*0.128+((34840-5225)*0.091)-25.94,($G35-5225)*0.091)-25.94,0) -> 1472 | O35: =SUM(L35+N35) -> 6242 | P35: =SUM(G35:N35) -> 27924
A36: 21050 | B36: 21 | G36: 21050 | L36: =ROUND(G36*0.22,0) -> 4631 | N36: =ROUND(IF($G36>34840,($G36-34840)*0.128+((34840-5225)*0.091)-25.94,($G36-5225)*0.091)-25.94,0) -> 1414 | O36: =SUM(L36+N36) -> 6045 | P36: =SUM(G36:N36) -> 27095
A37: 20458 | B37: 20 | G37: 20458 | L37: =ROUND(G37*0.22,0) -> 4501 | N37: =ROUND(IF($G37>34840,($G37-34840)*0.128+((34840-5225)*0.091)-25.94,($G37-5225)*0.091)-25.94,0) -> 1360 | O37: =SUM(L37+N37) -> 5861 | P37: =SUM(G37:N37) -> 26319
A38: 19841 | B38: 19 | G38: 19841 | L38: =ROUND(G38*0.22,0) -> 4365 | N38: =ROUND(IF($G38>34840,($G38-34840)*0.128+((34840-5225)*0.091)-25.94,($G38-5225)*0.091)-25.94,0) -> 1304 | O38: =SUM(L38+N38) -> 5669 | P38: =SUM(G38:N38) -> 25510
A39: 19264 | B39: 18 | F39: 19264 | G39: 19264 | L39: =ROUND(G39*0.22,0) -> 4238 | N39: =ROUND(IF($G39>34840,($G39-34840)*0.128+((34840-5225)*0.091)-25.94,($G39-5225)*0.091)-25.94,0) -> 1252 | O39: =SUM(L39+N39) -> 5490 | P39: =SUM(G39:N39) -> 24754
A40: 18702 | B40: 17 | F40: 18702 | G40: 18702 | L40: =ROUND(G40*0.22,0) -> 4114 | N40: =ROUND(IF($G40>34840,($G40-34840)*0.128+((34840-5225)*0.091)-25.94,($G40-5225)*0.091)-25.94,0) -> 1200 | O40: =SUM(L40+N40) -> 5314 | P40: =SUM(G40:N40) -> 24016
A41: 18165 | B41: 16 | F41: 18165 | G41: 18165 | L41: =ROUND(G41*0.22,0) -> 3996 | N41: =ROUND(IF($G41>34840,($G41-34840)*0.128+((34840-5225)*0.091)-25.94,($G41-5225)*0.091)-25.94,0) -> 1152 | O41: =SUM(L41+N41) -> 5148 | P41: =SUM(G41:N41) -> 23313
A42: 17651 | B42: 15 | F42: 17651 | L42: =ROUND(F42*0.22,0) -> 3883 | N42: =ROUND(IF($F42>34840,($F42-34840)*0.128+((34840-5225)*0.091)-25.94,($F42-5225)*0.091)-25.94,0) -> 1105 | O42: =SUM(L42+N42) -> 4988 | P42: =SUM(F42:N42) -> 22639
A43: 17152 | B43: 14 | F43: 17152 | L43: =ROUND(F43*0.22,0) -> 3773 | N43: =ROUND(IF($F43>34840,($F43-34840)*0.128+((34840-5225)*0.091)-25.94,($F43-5225)*0.091)-25.94,0) -> 1059 | O43: =SUM(L43+N43) -> 4832 | P43: =SUM(F43:N43) -> 21984
A44: 16669 | B44: 13 | E44: 16669 | F44: 16669 | L44: =ROUND(F44*0.22,0) -> 3667 | N44: =ROUND(IF($F44>34840,($F44-34840)*0.128+((34840-5225)*0.091)-25.94,($F44-5225)*0.091)-25.94,0) -> 1015 | O44: =SUM(L44+N44) -> 4682 | P44: =SUM(F44:N44) -> 21351
A45: 16199 | B45: 12 | E45: 16199 | F45: 16199 | L45: =ROUND(F45*0.22,0) -> 3564 | N45: =ROUND(IF($F45>34840,($F45-34840)*0.128+((34840-5225)*0.091)-25.94,($F45-5225)*0.091)-25.94,0) -> 973 | O45: =SUM(L45+N45) -> 4537 | P45: =SUM(F45:N45) -> 20736
A46: 15743 | B46: 11 | E46: 15743 | F46: 15743 | L46: =ROUND(F46*0.22,0) -> 3463 | N46: =ROUND(IF($F46>34840,($F46-34840)*0.128+((34840-5225)*0.091)-25.94,($F46-5225)*0.091)-25.94,0) -> 931 | O46: =SUM(L46+N46) -> 4394 | P46: =SUM(F46:N46) -> 20137
A47: 15300 | B47: 10 | E47: 15300 | L47: =ROUND(E47*0.22,0) -> 3366 | N47: =ROUND(IF($E47>34840,($E47-34840)*0.128+((34840-5225)*0.091)-25.94,($E47-5225)*0.091)-25.94,0) -> 891 | O47: =SUM(L47+N47) -> 4257 | P47: =SUM(E47:N47) -> 19557
A48: 14869 | B48: 9 | E48: 14869 | L48: =ROUND(E48*0.22,0) -> 3271 | N48: =ROUND(IF($E48>34840,($E48-34840)*0.128+((34840-5225)*0.091)-25.94,($E48-5225)*0.091)-25.94,0) -> 852 | O48: =SUM(L48+N48) -> 4123 | P48: =SUM(E48:N48) -> 18992
A49: 14462 | B49: 8 | E49: 14462 | L49: =ROUND(E49*0.22,0) -> 3182 | N49: =ROUND(IF($E49>34840,($E49-34840)*0.128+((34840-5225)*0.091)-25.94,($E49-5225)*0.091)-25.94,0) -> 815 | O49: =SUM(L49+N49) -> 3997 | P49: =SUM(E49:N49) -> 18459
A50: 14069 | B50: 7 | E50: 14069 | L50: =ROUND(E50*0.22,0) -> 3095 | N50: =ROUND(IF($E50>34840,($E50-34840)*0.128+((34840-5225)*0.091)-25.94,($E50-5225)*0.091)-25.94,0) -> 779 | O50: =SUM(L50+N50) -> 3874 | P50: =SUM(E50:N50) -> 17943
A51: 13739 | B51: 6 | D51: 13739 | E51: 13739 | L51: =ROUND(E51*0.22,0) -> 3023 | N51: =ROUND(IF($D51>34840,($D51-34840)*0.128+((34840-5225)*0.091)-25.94,($D51-5225)*0.091)-25.94,0) -> 749 | O51: =SUM(L51+N51) -> 3772 | P51: =SUM(E51:N51) -> 17511
A52: 13368 | B52: 5 | D52: 13368 | L52: =ROUND(D51*0.22,0) -> 3023 | N52: =ROUND(IF($D52>34840,($D52-34840)*0.128+((34840-5225)*0.091)-25.94,($D52-5225)*0.091)-25.94,0) -> 715 | O52: =SUM(L52+N52) -> 3738 | P52: =SUM(D52:N52) -> 17106
A53: 13008 | B53: 4 | D53: 13008 | L53: =ROUND(D52*0.22,0) -> 2941 | N53: =ROUND(IF($D53>34840,($D53-34840)*0.128+((34840-5225)*0.091)-25.94,($D53-5225)*0.091)-25.94,0) -> 682 | O53: =SUM(L53+N53) -> 3623 | P53: =SUM(D53:N53) -> 16631
A54: 12710 | B54: 3 | C54: 12710 | D54: 12710 | L54: =ROUND(D53*0.22,0) -> 2862 | N54: =ROUND(IF($D54>34840,($D54-34840)*0.128+((34840-5225)*0.091)-25.94,($D54-5225)*0.091)-25.94,0) -> 655 | O54: =SUM(L54+N54) -> 3517 | P54: =SUM(D54:N54) -> 16227
A55: 12371 | B55: 2 | C55: 12371 | L55: =ROUND(C54*0.22,0) -> 2796 | N55: =ROUND(IF($C55>34840,($C55-34840)*0.128+((34840-5225)*0.091)-25.94,($C55-5225)*0.091)-25.94,0) -> 624 | O55: =SUM(L55+N55) -> 3420 | P55: =SUM(C55:N55) -> 15791
A56: 12041 | B56: 1 | C56: 12041 | L56: =ROUND(C55*0.22,0) -> 2722 | N56: =ROUND(IF($C56>34840,($C56-34840)*0.128+((34840-5225)*0.091)-25.94,($C56-5225)*0.091)-25.94,0) -> 594 | O56: =SUM(L56+N56) -> 3316 | P56: =SUM(C56:N56) -> 15357