B1: Single Pay Spine for Academic and HE Support Staff, October 2008
L2: Super. @ 22% for NASPS | M2: Super. @ 14% for USS | N2: Nat Ins (ERS) April 2007 | O2: Total Empl'rs Costs | P2: Gross May 2008
A3: £ | B3: Spine Point | C3: £ | D3: £ | E3: £ | F3: £ | G3: £ | H3: £ | I3: £ | J3: £ | K3: £ | L3: £ | M3: £ | N3: £ | O3: £ | P3: £
C4: Grade 1 | D4: Grade 2 | E4: Grade 3 | F4: Grade 4 | G4: Grade 5 | H4: Grade 6 | I4: Grade 7 | J4: Grade 8 | K4: Grade 9
A5: 55562.175000000003 | B5: 52 | K5: 55562.175000000003 | M5: =ROUND(K5*0.14,0) -> 7779 | N5: =ROUND(IF($K5>34840,($K5-34840)*0.128+((34840-5225)*0.091)-25.94,($K5-5225)*0.091)-25.94,0) -> 5296 | O5: =SUM(M5+N5) -> 13075 | P5: =SUM(K5:N5) -> 68637.175000000003
A6: 53943.7 | B6: 51 | K6: 53943.7 | M6: =ROUND(K6*0.14,0) -> 7552 | N6: =ROUND(IF($K6>34840,($K6-34840)*0.128+((34840-5225)*0.091)-25.94,($K6-5225)*0.091)-25.94,0) -> 5088 | O6: =SUM(M6+N6) -> 12640 | P6: =SUM(K6:N6) -> 66583.7
A7: 52372.375 | B7: 50 | K7: 52372.375 | M7: =ROUND(K7*0.14,0) -> 7332 | N7: =ROUND(IF($K7>34840,($K7-34840)*0.128+((34840-5225)*0.091)-25.94,($K7-5225)*0.091)-25.94,0) -> 4887 | O7: =SUM(M7+N7) -> 12219 | P7: =SUM(K7:N7) -> 64591.375
A8: 50846.15 | B8: 49 | K8: 50846.15 | M8: =ROUND(K8*0.14,0) -> 7118 | N8: =ROUND(IF($K8>34840,($K8-34840)*0.128+((34840-5225)*0.091)-25.94,($K8-5225)*0.091)-25.94,0) -> 4692 | O8: =SUM(M8+N8) -> 11810 | P8: =SUM(K8:N8) -> 62656.15
A9: 49365.025000000001 | B9: 48 | K9: 49365.025000000001 | M9: =ROUND(K9*0.14,0) -> 6911 | N9: =ROUND(IF($K9>34840,($K9-34840)*0.128+((34840-5225)*0.091)-25.94,($K9-5225)*0.091)-25.94,0) -> 4502 | O9: =SUM(M9+N9) -> 11413 | P9: =SUM(K9:N9) -> 60778.025000000001
A10: 47927.974999999999 | B10: 47 | J10: 47927.974999999999 | K10: 47927.974999999999 | M10: =ROUND(K10*0.14,0) -> 6710 | N10: =ROUND(IF($K10>34840,($K10-34840)*0.128+((34840-5225)*0.091)-25.94,($K10-5225)*0.091)-25.94,0) -> 4318 | O10: =SUM(M10+N10) -> 11028 | P10: =SUM(K10:N10) -> 58955.974999999999
A11: 46531.925000000003 | B11: 46 | J11: 46531.925000000003 | K11: 46531.925000000003 | M11: =ROUND(K11*0.14,0) -> 6514 | N11: =ROUND(IF($K11>34840,($K11-34840)*0.128+((34840-5225)*0.091)-25.94,($K11-5225)*0.091)-25.94,0) -> 4140 | O11: =SUM(M11+N11) -> 10654 | P11: =SUM(K11:N11) -> 57185.925000000003
A12: 45175.85 | B12: 45 | J12: 45175.85 | K12: 45175.85 | M12: =ROUND(K12*0.14,0) -> 6325 | N12: =ROUND(IF($K12>34840,($K12-34840)*0.128+((34840-5225)*0.091)-25.94,($K12-5225)*0.091)-25.94,0) -> 3966 | O12: =SUM(M12+N12) -> 10291 | P12: =SUM(K12:N12) -> 55466.85
A13: 43860.775000000001 | B13: 44 | J13: 43860.775000000001 | M13: =ROUND(J13*0.14,0) -> 6141 | N13: =ROUND(IF($J13>34840,($J13-34840)*0.128+((34840-5225)*0.091)-25.94,($J13-5225)*0.091)-25.94,0) -> 3798 | O13: =SUM(M13+N13) -> 9939 | P13: =SUM(J13:N13) -> 53799.775000000001
A14: 42583.625 | B14: 43 | J14: 42583.625 | M14: =ROUND(J14*0.14,0) -> 5962 | N14: =ROUND(IF($J14>34840,($J14-34840)*0.128+((34840-5225)*0.091)-25.94,($J14-5225)*0.091)-25.94,0) -> 3634 | O14: =SUM(M14+N14) -> 9596 | P14: =SUM(J14:N14) -> 52179.625
A15: 41342.35 | B15: 42 | J15: 41342.35 | M15: =ROUND(J15*0.14,0) -> 5788 | N15: =ROUND(IF($J15>34840,($J15-34840)*0.128+((34840-5225)*0.091)-25.94,($J15-5225)*0.091)-25.94,0) -> 3475 | O15: =SUM(M15+N15) -> 9263 | P15: =SUM(J15:N15) -> 50605.35
A16: 40139 | B16: 41 | J16: 40139 | M16: =ROUND(J16*0.14,0) -> 5619 | N16: =ROUND(IF($J16>34840,($J16-34840)*0.128+((34840-5225)*0.091)-25.94,($J16-5225)*0.091)-25.94,0) -> 3321 | O16: =SUM(M16+N16) -> 8940 | P16: =SUM(J16:N16) -> 49079
A17: 38969.474999999999 | B17: 40 | J17: 38969.474999999999 | M17: =ROUND(J17*0.14,0) -> 5456 | N17: =ROUND(IF($J17>34840,($J17-34840)*0.128+((34840-5225)*0.091)-25.94,($J17-5225)*0.091)-25.94,0) -> 3172 | O17: =SUM(M17+N17) -> 8628 | P17: =SUM(J17:N17) -> 47597.474999999999
A18: 37834.800000000003 | B18: 39 | I18: 37834.800000000003 | J18: 37834.800000000003 | M18: =ROUND(J18*0.14,0) -> 5297 | N18: =ROUND(IF($J18>34840,($J18-34840)*0.128+((34840-5225)*0.091)-25.94,($J18-5225)*0.091)-25.94,0) -> 3026 | O18: =SUM(M18+N18) -> 8323 | P18: =SUM(J18:N18) -> 46157.8
A19: 36754.45 | B19: 38 | I19: 36754.45 | M19: =ROUND(I19*0.14,0) -> 5146 | N19: =ROUND(IF($I19>34840,($I19-34840)*0.128+((34840-5225)*0.091)-25.94,($I19-5225)*0.091)-25.94,0) -> 2888 | O19: =SUM(M19+N19) -> 8034 | P19: =SUM(I19:N19) -> 44788.45
A20: 35662.824999999997 | B20: 37 | I20: 35662.824999999997 | M20: =ROUND(I20*0.14,0) -> 4993 | N20: =ROUND(IF($I20>34840,($I20-34840)*0.128+((34840-5225)*0.091)-25.94,($I20-5225)*0.091)-25.94,0) -> 2748 | O20: =SUM(M20+N20) -> 7741 | P20: =SUM(I20:N20) -> 43403.824999999997
A21: 34624.5 | B21: 36 | I21: 34624.5 | M21: =ROUND(I21*0.14,0) -> 4847 | N21: =ROUND(IF($I21>34840,($I21-34840)*0.128+((34840-5225)*0.091)-25.94,($I21-5225)*0.091)-25.94,0) -> 2649 | O21: =SUM(M21+N21) -> 7496 | P21: =SUM(I21:N21) -> 42120.5
A22: 33614.875 | B22: 35 | I22: 33614.875 | M22: =ROUND(I22*0.14,0) -> 4706 | N22: =ROUND(IF($I22>34840,($I22-34840)*0.128+((34840-5225)*0.091)-25.94,($I22-5225)*0.091)-25.94,0) -> 2558 | O22: =SUM(M22+N22) -> 7264 | P22: =SUM(I22:N22) -> 40878.875
A23: 32636 | B23: 34 | I23: 32636 | M23: =ROUND(I23*0.14,0) -> 4569 | N23: =ROUND(IF($I23>34840,($I23-34840)*0.128+((34840-5225)*0.091)-25.94,($I23-5225)*0.091)-25.94,0) -> 2468 | O23: =SUM(M23+N23) -> 7037 | P23: =SUM(I23:N23) -> 39673
A24: 31684.799999999999 | B24: 33 | I24: 31684.799999999999 | M24: =ROUND(I24*0.14,0) -> 4436 | N24: =ROUND(IF($I24>34840,($I24-34840)*0.128+((34840-5225)*0.091)-25.94,($I24-5225)*0.091)-25.94,0) -> 2382 | O24: =SUM(M24+N24) -> 6818 | P24: =SUM(I24:N24) -> 38502.800000000003
A25: 30763.325000000001 | B25: 32 | H25: 30763.325000000001 | I25: 30763.325000000001 | M25: =ROUND(I25*0.14,0) -> 4307 | N25: =ROUND(IF($I25>34840,($I25-34840)*0.128+((34840-5225)*0.091)-25.94,($I25-5225)*0.091)-25.94,0) -> 2298 | O25: =SUM(M25+N25) -> 6605 | P25: =SUM(I25:N25) -> 37368.324999999997
A26: 29866.45 | B26: 31 | H26: 29866.45 | M26: =ROUND(H26*0.14,0) -> 4181 | N26: =ROUND(IF($H26>34840,($H26-34840)*0.128+((34840-5225)*0.091)-25.94,($H26-5225)*0.091)-25.94,0) -> 2216 | O26: =SUM(M26+N26) -> 6397 | P26: =SUM(H26:N26) -> 36263.45
A27: 28997.25 | B27: 30 | H27: 28997.25 | M27: =ROUND(H27*0.14,0) -> 4060 | N27: =ROUND(IF($H27>34840,($H27-34840)*0.128+((34840-5225)*0.091)-25.94,($H27-5225)*0.091)-25.94,0) -> 2137 | O27: =SUM(M27+N27) -> 6197 | P27: =SUM(H27:N27) -> 35194.25
A28: 28152.65 | B28: 29 | H28: 28152.65 | M28: =ROUND(H28*0.14,0) -> 3941 | N28: =ROUND(IF($H28>34840,($H28-34840)*0.128+((34840-5225)*0.091)-25.94,($H28-5225)*0.091)-25.94,0) -> 2060 | O28: =SUM(M28+N28) -> 6001 | P28: =SUM(H28:N28) -> 34153.65
A29: 27331.625 | B29: 28 | H29: 27331.625 | M29: =ROUND(H29*0.14,0) -> 3826 | N29: =ROUND(IF($H29>34840,($H29-34840)*0.128+((34840-5225)*0.091)-25.94,($H29-5225)*0.091)-25.94,0) -> 1986 | O29: =SUM(M29+N29) -> 5812 | P29: =SUM(H29:N29) -> 33143.625
A30: 26535.200000000001 | B30: 27 | H30: 26535.200000000001 | M30: =ROUND(H30*0.14,0) -> 3715 | N30: =ROUND(IF($H30>34840,($H30-34840)*0.128+((34840-5225)*0.091)-25.94,($H30-5225)*0.091)-25.94,0) -> 1913 | O30: =SUM(M30+N30) -> 5628 | P30: =SUM(H30:N30) -> 32163.200000000001
A31: 25763.375 | B31: 26 | H31: 25763.375 | M31: =ROUND(H31*0.14,0) -> 3607 | N31: =ROUND(IF($H31>34840,($H31-34840)*0.128+((34840-5225)*0.091)-25.94,($H31-5225)*0.091)-25.94,0) -> 1843 | O31: =SUM(M31+N31) -> 5450 | P31: =SUM(H31:N31) -> 31213.375
A32: 25013.075000000001 | B32: 25 | G32: 25013.075000000001 | H32: 25013.075000000001 | L32: =ROUND(G32*0.22,0) -> 5503 | M32: =ROUND(H32*0.14,0) -> 3502 | N32: =ROUND(IF($H32>34840,($H32-34840)*0.128+((34840-5225)*0.091)-25.94,($H32-5225)*0.091)-25.94,0) -> 1775 | P32: NASPS = 32,291 & USS = 30,290
A33: 24284.3 | B33: 24 | G33: 24284.3 | L33: =ROUND(G33*0.22,0) -> 5343 | N33: =ROUND(IF($G33>34840,($G33-34840)*0.128+((34840-5225)*0.091)-25.94,($G33-5225)*0.091)-25.94,0) -> 1708 | O33: =SUM(L33+N33) -> 7051 | P33: =SUM(G33:N33) -> 31335.3
A34: 23577.05 | B34: 23 | G34: 23577.05 | L34: =ROUND(G34*0.22,0) -> 5187 | N34: =ROUND(IF($G34>34840,($G34-34840)*0.128+((34840-5225)*0.091)-25.94,($G34-5225)*0.091)-25.94,0) -> 1644 | O34: =SUM(L34+N34) -> 6831 | P34: =SUM(G34:N34) -> 30408.05
A35: 22890.3 | B35: 22 | G35: 22890.3 | L35: =ROUND(G35*0.22,0) -> 5036 | N35: =ROUND(IF($G35>34840,($G35-34840)*0.128+((34840-5225)*0.091)-25.94,($G35-5225)*0.091)-25.94,0) -> 1582 | O35: =SUM(L35+N35) -> 6618 | P35: =SUM(G35:N35) -> 29508.3
A36: 22223.025000000001 | B36: 21 | G36: 22223.025000000001 | L36: =ROUND(G36*0.22,0) -> 4889 | N36: =ROUND(IF($G36>34840,($G36-34840)*0.128+((34840-5225)*0.091)-25.94,($G36-5225)*0.091)-25.94,0) -> 1521 | O36: =SUM(L36+N36) -> 6410 | P36: =SUM(G36:N36) -> 28633.025000000001
A37: 21598.799999999999 | B37: 20 | G37: 21598.799999999999 | L37: =ROUND(G37*0.22,0) -> 4752 | N37: =ROUND(IF($G37>34840,($G37-34840)*0.128+((34840-5225)*0.091)-25.94,($G37-5225)*0.091)-25.94,0) -> 1464 | O37: =SUM(L37+N37) -> 6216 | P37: =SUM(G37:N37) -> 27814.799999999999
A38: 20946.9 | B38: 19 | G38: 20946.9 | L38: =ROUND(G38*0.22,0) -> 4608 | N38: =ROUND(IF($G38>34840,($G38-34840)*0.128+((34840-5225)*0.091)-25.94,($G38-5225)*0.091)-25.94,0) -> 1405 | O38: =SUM(L38+N38) -> 6013 | P38: =SUM(G38:N38) -> 26959.9
A39: 20337.025000000001 | B39: 18 | F39: 20337.025000000001 | G39: 20337.025000000001 | L39: =ROUND(G39*0.22,0) -> 4474 | N39: =ROUND(IF($G39>34840,($G39-34840)*0.128+((34840-5225)*0.091)-25.94,($G39-5225)*0.091)-25.94,0) -> 1349 | O39: =SUM(L39+N39) -> 5823 | P39: =SUM(G39:N39) -> 26160.025000000001
A40: 19744.575000000001 | B40: 17 | F40: 19744.575000000001 | G40: 19744.575000000001 | L40: =ROUND(G40*0.22,0) -> 4344 | N40: =ROUND(IF($G40>34840,($G40-34840)*0.128+((34840-5225)*0.091)-25.94,($G40-5225)*0.091)-25.94,0) -> 1295 | O40: =SUM(L40+N40) -> 5639 | P40: =SUM(G40:N40) -> 25383.575000000001
A41: 19177.75 | B41: 16 | F41: 19177.75 | G41: 19177.75 | L41: =ROUND(G41*0.22,0) -> 4219 | N41: =ROUND(IF($G41>34840,($G41-34840)*0.128+((34840-5225)*0.091)-25.94,($G41-5225)*0.091)-25.94,0) -> 1244 | O41: =SUM(L41+N41) -> 5463 | P41: =SUM(G41:N41) -> 24640.75
A42: 18634.5 | B42: 15 | F42: 18634.5 | L42: =ROUND(F42*0.22,0) -> 4100 | N42: =ROUND(IF($F42>34840,($F42-34840)*0.128+((34840-5225)*0.091)-25.94,($F42-5225)*0.091)-25.94,0) -> 1194 | O42: =SUM(L42+N42) -> 5294 | P42: =SUM(F42:N42) -> 23928.5
A43: 18108.674999999999 | B43: 14 | F43: 18108.674999999999 | L43: =ROUND(F43*0.22,0) -> 3984 | N43: =ROUND(IF($F43>34840,($F43-34840)*0.128+((34840-5225)*0.091)-25.94,($F43-5225)*0.091)-25.94,0) -> 1146 | O43: =SUM(L43+N43) -> 5130 | P43: =SUM(F43:N43) -> 23238.674999999999
A44: 17598.224999999999 | B44: 13 | E44: 17598.224999999999 | F44: 17598.224999999999 | L44: =ROUND(F44*0.22,0) -> 3872 | N44: =ROUND(IF($F44>34840,($F44-34840)*0.128+((34840-5225)*0.091)-25.94,($F44-5225)*0.091)-25.94,0) -> 1100 | O44: =SUM(L44+N44) -> 4972 | P44: =SUM(F44:N44) -> 22570.224999999999
A45: 17101.1 | B45: 12 | E45: 17101.1 | F45: 17101.1 | L45: =ROUND(F45*0.22,0) -> 3762 | N45: =ROUND(IF($F45>34840,($F45-34840)*0.128+((34840-5225)*0.091)-25.94,($F45-5225)*0.091)-25.94,0) -> 1055 | O45: =SUM(L45+N45) -> 4817 | P45: =SUM(F45:N45) -> 21918.1
A46: 16620.375 | B46: 11 | E46: 16620.375 | F46: 16620.375 | L46: =ROUND(F46*0.22,0) -> 3656 | N46: =ROUND(IF($F46>34840,($F46-34840)*0.128+((34840-5225)*0.091)-25.94,($F46-5225)*0.091)-25.94,0) -> 1011 | O46: =SUM(L46+N46) -> 4667 | P46: =SUM(F46:N46) -> 21287.375
A47: 16152.975 | B47: 10 | E47: 16152.975 | L47: =ROUND(E47*0.22,0) -> 3554 | N47: =ROUND(IF($E47>34840,($E47-34840)*0.128+((34840-5225)*0.091)-25.94,($E47-5225)*0.091)-25.94,0) -> 969 | O47: =SUM(L47+N47) -> 4523 | P47: =SUM(E47:N47) -> 20675.974999999999
A48: 15697.875 | B48: 9 | E48: 15697.875 | L48: =ROUND(E48*0.22,0) -> 3454 | N48: =ROUND(IF($E48>34840,($E48-34840)*0.128+((34840-5225)*0.091)-25.94,($E48-5225)*0.091)-25.94,0) -> 927 | O48: =SUM(L48+N48) -> 4381 | P48: =SUM(E48:N48) -> 20078.875
A49: 15268.4 | B49: 8 | E49: 15268.4 | L49: =ROUND(E49*0.22,0) -> 3359 | N49: =ROUND(IF($E49>34840,($E49-34840)*0.128+((34840-5225)*0.091)-25.94,($E49-5225)*0.091)-25.94,0) -> 888 | O49: =SUM(L49+N49) -> 4247 | P49: =SUM(E49:N49) -> 19515.4
A50: 14853.275 | B50: 7 | E50: 14853.275 | L50: =ROUND(E50*0.22,0) -> 3268 | N50: =ROUND(IF($E50>34840,($E50-34840)*0.128+((34840-5225)*0.091)-25.94,($E50-5225)*0.091)-25.94,0) -> 850 | O50: =SUM(L50+N50) -> 4118 | P50: =SUM(E50:N50) -> 18971.275000000001
A51: 14512.975 | B51: 6 | D51: 14512.975 | E51: 14512.975 | L51: =ROUND(E51*0.22,0) -> 3193 | N51: =ROUND(IF($E51>34840,($E51-34840)*0.128+((34840-5225)*0.091)-25.94,($E51-5225)*0.091)-25.94,0) -> 819 | O51: =SUM(L51+N51) -> 4012 | P51: =SUM(E51:N51) -> 18524.974999999999
A52: 14132.7 | B52: 5 | D52: 14132.7 | L52: =ROUND(D51*0.22,0) -> 3193 | N52: =ROUND(IF($D52>34840,($D52-34840)*0.128+((34840-5225)*0.091)-25.94,($D52-5225)*0.091)-25.94,0) -> 785 | O52: =SUM(L52+N52) -> 3978 | P52: =SUM(D52:N52) -> 18110.7
A53: 13763.7 | B53: 4 | D53: 13763.7 | L53: =ROUND(D52*0.22,0) -> 3109 | N53: =ROUND(IF($D53>34840,($D53-34840)*0.128+((34840-5225)*0.091)-25.94,($D53-5225)*0.091)-25.94,0) -> 751 | O53: =SUM(L53+N53) -> 3860 | P53: =SUM(D53:N53) -> 17623.7
A54: 13458.25 | B54: 3 | C54: 13458.25 | D54: 13458.25 | L54: =ROUND(D53*0.22,0) -> 3028 | N54: =ROUND(IF($D54>34840,($D54-34840)*0.128+((34840-5225)*0.091)-25.94,($D54-5225)*0.091)-25.94,0) -> 723 | O54: =SUM(L54+N54) -> 3751 | P54: =SUM(D54:N54) -> 17209.25
A55: 13110.775 | B55: 2 | C55: 13110.775 | L55: =ROUND(C54*0.22,0) -> 2961 | N55: =ROUND(IF($C55>34840,($C55-34840)*0.128+((34840-5225)*0.091)-25.94,($C55-5225)*0.091)-25.94,0) -> 692 | O55: =SUM(L55+N55) -> 3653 | P55: =SUM(C55:N55) -> 16763.775000000001
A56: 12772.525 | B56: 1 | C56: 12772.525 | L56: =ROUND(C55*0.22,0) -> 2884 | N56: =ROUND(IF($C56>34840,($C56-34840)*0.128+((34840-5225)*0.091)-25.94,($C56-5225)*0.091)-25.94,0) -> 661 | O56: =SUM(L56+N56) -> 3545 | P56: =SUM(C56:N56) -> 16317.525